[
  {
    "exercise_id": "EX001",
    "canonical_name": "Push-Up",
    "tier": 1,
    "alloy_observed": true,
    "source_ids": [
      "https://alloypersonaltraining.com/deck-cards-exercise-snapshot-push/"
    ],
    "primary_pattern": "Push",
    "secondary_patterns": [
      "Core Stabilization"
    ],
    "upper_lower": "Upper",
    "push_pull": "Push",
    "horizontal_vertical": null,
    "unilateral_bilateral": "Bilateral",
    "stance": null,
    "plane": null,
    "equipment_requirements": [
      "Bodyweight",
      "Suspension Trainer",
      "Dumbbells"
    ],
    "strength": true,
    "power": true,
    "conditioning": false,
    "mobility": null,
    "core_function": "Anti-extension",
    "observed_rep_ranges": "15, 20",
    "observed_set_ranges": "3, 4",
    "observed_time_prescriptions": null,
    "observed_pairings": "Paired with Floor Press in compound sets; Burpees in AMRAPs",
    "observed_workout_formats": "5-10-15-20-25 Ladder, EMOM, AMRAP, Compound Sets",
    "documented_progressions": "Resisted Push-Up, Explosive Push-Up",
    "documented_regressions": "Knee Push-Up, Elevated Push-Up",
    "documented_substitutions": null,
    "documented_coaching_cues": "Place hands firmly on ground under shoulders. Tighten core, engage glutes and hamstrings, flatten back. Tuck chin in. Lower body until chest touches floor. Keep elbows tucked.",
    "documented_purpose": "Strengthens chest, triceps, shoulders, and anterior/posterior anti-extension core muscles. Safer for shoulders than traditional horizontal pushes.",
    "evidence_classification": "ALLOY_DOCUMENTED",
    "notes": null
  },
  {
    "exercise_id": "EX002",
    "canonical_name": "Jump Lunges",
    "tier": 1,
    "alloy_observed": true,
    "source_ids": [
      "https://alloypersonaltraining.com/15-minute-no-equipment-workout/"
    ],
    "primary_pattern": "Lunge",
    "secondary_patterns": [
      "Plyometric"
    ],
    "upper_lower": "Lower",
    "push_pull": "Push",
    "horizontal_vertical": null,
    "unilateral_bilateral": "Unilateral",
    "stance": null,
    "plane": null,
    "equipment_requirements": [
      "Bodyweight"
    ],
    "strength": false,
    "power": true,
    "conditioning": true,
    "mobility": null,
    "core_function": "Dynamic Stabilization",
    "observed_rep_ranges": "10, 20, Ascending",
    "observed_set_ranges": "3, 4+",
    "observed_time_prescriptions": null,
    "observed_pairings": "Sequenced with Burpees and Pushups",
    "observed_workout_formats": "EMOMs, Ladders, Timed Ascending Circuits",
    "documented_progressions": null,
    "documented_regressions": null,
    "documented_substitutions": null,
    "documented_coaching_cues": null,
    "documented_purpose": "Bodyweight anaerobic conditioning and explosive lower body power.",
    "evidence_classification": "ALLOY_DOCUMENTED",
    "notes": null
  },
  {
    "exercise_id": "EX003",
    "canonical_name": "Bird Dog Plank",
    "tier": 1,
    "alloy_observed": true,
    "source_ids": [
      "https://alloypersonaltraining.com/15-minute-no-equipment-workout/"
    ],
    "primary_pattern": "Core",
    "secondary_patterns": [
      "Isometrics"
    ],
    "upper_lower": "Core",
    "push_pull": "N/A",
    "horizontal_vertical": null,
    "unilateral_bilateral": "Contralateral",
    "stance": null,
    "plane": null,
    "equipment_requirements": [
      "Bodyweight"
    ],
    "strength": false,
    "power": false,
    "conditioning": false,
    "mobility": null,
    "core_function": "Anti-rotation / Anti-extension",
    "observed_rep_ranges": "20",
    "observed_set_ranges": "3",
    "observed_time_prescriptions": null,
    "observed_pairings": "Sequenced after plyometrics to enforce static stability",
    "observed_workout_formats": "EMOM (Top of the Minute)",
    "documented_progressions": null,
    "documented_regressions": null,
    "documented_substitutions": null,
    "documented_coaching_cues": null,
    "documented_purpose": "Strengthens the core via anti-extension and anti-rotation, building immense core strength.",
    "evidence_classification": "ALLOY_DOCUMENTED",
    "notes": null
  },
  {
    "exercise_id": "EX004",
    "canonical_name": "Touch Down Squats",
    "tier": 1,
    "alloy_observed": true,
    "source_ids": [
      "https://alloypersonaltraining.com/15-minute-no-equipment-workout/"
    ],
    "primary_pattern": "Squat",
    "secondary_patterns": [
      "Bodyweight"
    ],
    "upper_lower": "Lower",
    "push_pull": "Push",
    "horizontal_vertical": null,
    "unilateral_bilateral": "Bilateral",
    "stance": null,
    "plane": null,
    "equipment_requirements": [
      "Bodyweight"
    ],
    "strength": false,
    "power": false,
    "conditioning": true,
    "mobility": null,
    "core_function": null,
    "observed_rep_ranges": null,
    "observed_set_ranges": "3",
    "observed_time_prescriptions": null,
    "observed_pairings": "Sequenced within bodyweight circuits",
    "observed_workout_formats": "EMOM (Top of the Minute)",
    "documented_progressions": null,
    "documented_regressions": null,
    "documented_substitutions": null,
    "documented_coaching_cues": null,
    "documented_purpose": "Bodyweight conditioning and lower body endurance.",
    "evidence_classification": "ALLOY_DOCUMENTED",
    "notes": null
  },
  {
    "exercise_id": "EX005",
    "canonical_name": "Yard Sprint",
    "tier": 1,
    "alloy_observed": true,
    "source_ids": [
      "https://alloypersonaltraining.com/15-minute-no-equipment-workout/"
    ],
    "primary_pattern": "Locomotion",
    "secondary_patterns": [
      "Sprint"
    ],
    "upper_lower": "Full",
    "push_pull": "N/A",
    "horizontal_vertical": null,
    "unilateral_bilateral": "Alternating",
    "stance": null,
    "plane": null,
    "equipment_requirements": [
      "Bodyweight"
    ],
    "strength": false,
    "power": true,
    "conditioning": true,
    "mobility": null,
    "core_function": null,
    "observed_rep_ranges": "25, 50 yards",
    "observed_set_ranges": "3, 4",
    "observed_time_prescriptions": null,
    "observed_pairings": "Placed at the end of ladders as a cardiovascular spike",
    "observed_workout_formats": "EMOM, Ladders",
    "documented_progressions": null,
    "documented_regressions": null,
    "documented_substitutions": null,
    "documented_coaching_cues": null,
    "documented_purpose": "Cardiovascular conditioning and anaerobic threshold training.",
    "evidence_classification": "ALLOY_DOCUMENTED",
    "notes": null
  },
  {
    "exercise_id": "EX006",
    "canonical_name": "Burpee",
    "tier": 1,
    "alloy_observed": true,
    "source_ids": [
      "https://alloypersonaltraining.com/5-10-15-20-25-workout/"
    ],
    "primary_pattern": "Full Body",
    "secondary_patterns": [
      "Plyometric"
    ],
    "upper_lower": "Full",
    "push_pull": "Push/Pull",
    "horizontal_vertical": null,
    "unilateral_bilateral": "Bilateral",
    "stance": null,
    "plane": null,
    "equipment_requirements": [
      "Bodyweight"
    ],
    "strength": false,
    "power": true,
    "conditioning": true,
    "mobility": null,
    "core_function": "Dynamic Stabilization",
    "observed_rep_ranges": "5, 15",
    "observed_set_ranges": "4+",
    "observed_time_prescriptions": null,
    "observed_pairings": "Sequenced with Jump Lunges and Pushups",
    "observed_workout_formats": "5-10-15-20-25 Ladder, 20-min AMRAP",
    "documented_progressions": null,
    "documented_regressions": "Elevated hands on surface",
    "documented_substitutions": null,
    "documented_coaching_cues": null,
    "documented_purpose": "Total body anaerobic conditioning and metabolic demand.",
    "evidence_classification": "ALLOY_DOCUMENTED",
    "notes": null
  },
  {
    "exercise_id": "EX007",
    "canonical_name": "Overhead Squat",
    "tier": 1,
    "alloy_observed": true,
    "source_ids": [
      "https://alloypersonaltraining.com/5-10-15-20-25-workout/"
    ],
    "primary_pattern": "Squat",
    "secondary_patterns": [
      "Thoracic Extension"
    ],
    "upper_lower": "Lower",
    "push_pull": "Push",
    "horizontal_vertical": null,
    "unilateral_bilateral": "Bilateral",
    "stance": null,
    "plane": null,
    "equipment_requirements": [
      "Bodyweight"
    ],
    "strength": true,
    "power": false,
    "conditioning": false,
    "mobility": null,
    "core_function": "Anti-flexion",
    "observed_rep_ranges": "20",
    "observed_set_ranges": "4+",
    "observed_time_prescriptions": null,
    "observed_pairings": "Follows pushups in conditioning ladders",
    "observed_workout_formats": "5-10-15-20-25 Ladder",
    "documented_progressions": null,
    "documented_regressions": null,
    "documented_substitutions": null,
    "documented_coaching_cues": "Hold arms in a \"Y\" position while descending into a squat.",
    "documented_purpose": "Full body mobility, thoracic extension, and lower body strength.",
    "evidence_classification": "ALLOY_DOCUMENTED",
    "notes": null
  },
  {
    "exercise_id": "EX008",
    "canonical_name": "Single-Arm Kettlebell Swing",
    "tier": 1,
    "alloy_observed": true,
    "source_ids": [
      "https://alloypersonaltraining.com/power-5-workout/"
    ],
    "primary_pattern": "Hinge",
    "secondary_patterns": [
      "Core Stabilization"
    ],
    "upper_lower": "Lower",
    "push_pull": "Pull",
    "horizontal_vertical": null,
    "unilateral_bilateral": "Unilateral",
    "stance": null,
    "plane": null,
    "equipment_requirements": [
      "Kettlebell"
    ],
    "strength": false,
    "power": true,
    "conditioning": true,
    "mobility": null,
    "core_function": "Anti-rotation",
    "observed_rep_ranges": "5",
    "observed_set_ranges": "5",
    "observed_time_prescriptions": null,
    "observed_pairings": "Initiator for the \"Power of 5\" complex",
    "observed_workout_formats": "Complexes, Conditioning Circuits",
    "documented_progressions": "Load and ROM increases",